{
  "candidate_processes_remained_live": true,
  "cleanup_succeeded": true,
  "formal_seconds": 3600,
  "formal_soak_executed": true,
  "max_fds": 15,
  "max_in_flight": 4,
  "max_manager_connections": 1,
  "max_queued": 40,
  "max_rss_bytes": 24367104,
  "max_threads": 18,
  "module_id": "MOD-PLUGIN-001",
  "qualification": "NOT_QUALIFIED",
  "reason_code": "FORMAL_PLUGIN_HOST_SOAK_COMPLETE",
  "resource_growth": {
    "fds_delta": 0,
    "in_flight_final": 0,
    "leak_thresholds_passed": true,
    "queued_final": 0,
    "rss_bytes_delta": 5214208,
    "sample_count": 368,
    "threads_delta": 8
  },
  "resource_samples": [
    {
      "elapsed_unix_ms": 1787295896118,
      "fds": 15,
      "in_flight": 0,
      "manager_connections": 1,
      "manager_connections_peak": 1,
      "queued": 0,
      "rss_bytes": 19152896,
      "threads": 10
    },
    {
      "elapsed_unix_ms": 1787295906119,
      "fds": 15,
      "in_flight": 1,
      "manager_connections": 1,
      "manager_connections_peak": 1,
      "queued": 0,
      "rss_bytes": 19292160,
      "threads": 10
    },
    {
      "elapsed_unix_ms": 1787295916118,
      "fds": 15,
      "in_flight": 0,
      "manager_connections": 1,
      "manager_connections_peak": 1,
      "queued": 0,
      "rss_bytes": 19337216,
      "threads": 10
    },
    {
      "elapsed_unix_ms": 1787295926119,
      "fds": 15,
      "in_flight": 0,
      "manager_connections": 1,
      "manager_connections_peak": 1,
      "queued": 0,
      "rss_bytes": 19390464,
      "threads": 10
    },
    {
      "elapsed_unix_ms": 1787295936120,
      "fds": 15,
      "in_flight": 0,
      "manager_connections": 1,
      "manager_connections_peak": 1,
      "queued": 0,
      "rss_bytes": 19431424,
      "threads": 10
    },
    {
      "elapsed_unix_ms": 1787295946119,
      "fds": 15,
      "in_flight": 0,
      "manager_connections": 1,
      "manager_connections_peak": 1,
      "queued": 0,
      "rss_bytes": 19447808,
      "threads": 10
    },
    {
      "elapsed_unix_ms": 1787295956119,
      "fds": 15,
      "in_flight": 0,
      "manager_connections": 1,
      "manager_connections_peak": 1,
      "queued": 0,
      "rss_bytes": 19456000,
      "threads": 10
    },
    {
      "elapsed_unix_ms": 1787295966118,
      "fds": 15,
      "in_flight": 0,
      "manager_connections": 1,
      "manager_connections_peak": 1,
      "queued": 0,
      "rss_bytes": 19464192,
      "threads": 10
    },
    {
      "elapsed_unix_ms": 1787295976118,
      "fds": 15,
      "in_flight": 1,
      "manager_connections": 1,
      "manager_connections_peak": 1,
      "queued": 0,
      "rss_bytes": 19468288,
      "threads": 10
    },
    {
      "elapsed_unix_ms": 1787295986119,
      "fds": 15,
      "in_flight": 0,
      "manager_connections": 1,
      "manager_connections_peak": 1,
      "queued": 0,
      "rss_bytes": 19476480,
      "threads": 10
    },
    {
      "elapsed_unix_ms": 1787295996118,
      "fds": 15,
      "in_flight": 0,
      "manager_connections": 1,
      "manager_connections_peak": 1,
      "queued": 0,
      "rss_bytes": 19480576,
      "threads": 10
    },
    {
      "elapsed_unix_ms": 1787296006120,
      "fds": 15,
      "in_flight": 0,
      "manager_connections": 1,
      "manager_connections_peak": 1,
      "queued": 0,
      "rss_bytes": 19492864,
      "threads": 10
    },
    {
      "elapsed_unix_ms": 1787296016118,
      "fds": 15,
      "in_flight": 0,
      "manager_connections": 1,
      "manager_connections_peak": 1,
      "queued": 0,
      "rss_bytes": 19496960,
      "threads": 10
    },
    {
      "elapsed_unix_ms": 1787296026118,
      "fds": 15,
      "in_flight": 0,
      "manager_connections": 1,
      "manager_connections_peak": 1,
      "queued": 0,
      "rss_bytes": 19521536,
      "threads": 10
    },
    {
      "elapsed_unix_ms": 1787296036118,
      "fds": 15,
      "in_flight": 0,
      "manager_connections": 1,
      "manager_connections_peak": 1,
      "queued": 0,
      "rss_bytes": 19537920,
      "threads": 10
    },
    {
      "elapsed_unix_ms": 1787296046118,
      "fds": 15,
      "in_flight": 1,
      "manager_connections": 1,
      "manager_connections_peak": 1,
      "queued": 0,
      "rss_bytes": 19546112,
      "threads": 10
    },
    {
      "elapsed_unix_ms": 1787296056119,
      "fds": 15,
      "in_flight": 0,
      "manager_connections": 1,
      "manager_connections_peak": 1,
      "queued": 0,
      "rss_bytes": 19550208,
      "threads": 10
    },
    {
      "elapsed_unix_ms": 1787296066118,
      "fds": 15,
      "in_flight": 0,
      "manager_connections": 1,
      "manager_connections_peak": 1,
      "queued": 0,
      "rss_bytes": 19558400,
      "threads": 10
    },
    {
      "elapsed_unix_ms": 1787296076118,
      "fds": 15,
      "in_flight": 0,
      "manager_connections": 1,
      "manager_connections_peak": 1,
      "queued": 0,
      "rss_bytes": 19562496,
      "threads": 10
    },
    {
      "elapsed_unix_ms": 1787296086119,
      "fds": 15,
      "in_flight": 0,
      "manager_connections": 1,
      "manager_connections_peak": 1,
      "queued": 0,
      "rss_bytes": 19562496,
      "threads": 10
    },
    {
      "elapsed_unix_ms": 1787296096118,
      "fds": 15,
      "in_flight": 0,
      "manager_connections": 1,
      "manager_connections_peak": 1,
      "queued": 0,
      "rss_bytes": 19566592,
      "threads": 10
    },
    {
      "elapsed_unix_ms": 1787296106120,
      "fds": 15,
      "in_flight": 0,
      "manager_connections": 1,
      "manager_connections_peak": 1,
      "queued": 0,
      "rss_bytes": 19570688,
      "threads": 10
    },
    {
      "elapsed_unix_ms": 1787296116118,
      "fds": 15,
      "in_flight": 0,
      "manager_connections": 1,
      "manager_connections_peak": 1,
      "queued": 0,
      "rss_bytes": 19570688,
      "threads": 10
    },
    {
      "elapsed_unix_ms": 1787296126120,
      "fds": 15,
      "in_flight": 1,
      "manager_connections": 1,
      "manager_connections_peak": 1,
      "queued": 0,
      "rss_bytes": 19570688,
      "threads": 10
    },
    {
      "elapsed_unix_ms": 1787296136118,
      "fds": 15,
      "in_flight": 0,
      "manager_connections": 1,
      "manager_connections_peak": 1,
      "queued": 0,
      "rss_bytes": 19574784,
      "threads": 10
    },
    {
      "elapsed_unix_ms": 1787296146118,
      "fds": 15,
      "in_flight": 0,
      "manager_connections": 1,
      "manager_connections_peak": 1,
      "queued": 0,
      "rss_bytes": 19574784,
      "threads": 10
    },
    {
      "elapsed_unix_ms": 1787296156118,
      "fds": 15,
      "in_flight": 0,
      "manager_connections": 1,
      "manager_connections_peak": 1,
      "queued": 0,
      "rss_bytes": 19578880,
      "threads": 10
    },
    {
      "elapsed_unix_ms": 1787296166119,
      "fds": 15,
      "in_flight": 0,
      "manager_connections": 1,
      "manager_connections_peak": 1,
      "queued": 0,
      "rss_bytes": 19582976,
      "threads": 10
    },
    {
      "elapsed_unix_ms": 1787296176118,
      "fds": 15,
      "in_flight": 0,
      "manager_connections": 1,
      "manager_connections_peak": 1,
      "queued": 0,
      "rss_bytes": 19595264,
      "threads": 10
    },
    {
      "elapsed_unix_ms": 1787296186118,
      "fds": 15,
      "in_flight": 0,
      "manager_connections": 1,
      "manager_connections_peak": 1,
      "queued": 0,
      "rss_bytes": 19599360,
      "threads": 10
    },
    {
      "elapsed_unix_ms": 1787296196118,
      "fds": 15,
      "in_flight": 0,
      "manager_connections": 1,
      "manager_connections_peak": 1,
      "queued": 0,
      "rss_bytes": 19603456,
      "threads": 10
    },
    {
      "elapsed_unix_ms": 1787296206118,
      "fds": 15,
      "in_flight": 1,
      "manager_connections": 1,
      "manager_connections_peak": 1,
      "queued": 0,
      "rss_bytes": 19619840,
      "threads": 10
    },
    {
      "elapsed_unix_ms": 1787296216119,
      "fds": 15,
      "in_flight": 0,
      "manager_connections": 1,
      "manager_connections_peak": 1,
      "queued": 0,
      "rss_bytes": 19623936,
      "threads": 10
    },
    {
      "elapsed_unix_ms": 1787296226118,
      "fds": 15,
      "in_flight": 0,
      "manager_connections": 1,
      "manager_connections_peak": 1,
      "queued": 0,
      "rss_bytes": 19623936,
      "threads": 10
    },
    {
      "elapsed_unix_ms": 1787296236119,
      "fds": 15,
      "in_flight": 0,
      "manager_connections": 1,
      "manager_connections_peak": 1,
      "queued": 0,
      "rss_bytes": 19623936,
      "threads": 10
    },
    {
      "elapsed_unix_ms": 1787296246119,
      "fds": 15,
      "in_flight": 0,
      "manager_connections": 1,
      "manager_connections_peak": 1,
      "queued": 0,
      "rss_bytes": 19628032,
      "threads": 10
    },
    {
      "elapsed_unix_ms": 1787296256118,
      "fds": 15,
      "in_flight": 0,
      "manager_connections": 1,
      "manager_connections_peak": 1,
      "queued": 0,
      "rss_bytes": 19636224,
      "threads": 10
    },
    {
      "elapsed_unix_ms": 1787296266118,
      "fds": 15,
      "in_flight": 0,
      "manager_connections": 1,
      "manager_connections_peak": 1,
      "queued": 0,
      "rss_bytes": 19640320,
      "threads": 10
    },
    {
      "elapsed_unix_ms": 1787296276117,
      "fds": 15,
      "in_flight": 1,
      "manager_connections": 1,
      "manager_connections_peak": 1,
      "queued": 0,
      "rss_bytes": 19640320,
      "threads": 10
    },
    {
      "elapsed_unix_ms": 1787296286119,
      "fds": 15,
      "in_flight": 0,
      "manager_connections": 1,
      "manager_connections_peak": 1,
      "queued": 0,
      "rss_bytes": 19640320,
      "threads": 10
    },
    {
      "elapsed_unix_ms": 1787296296119,
      "fds": 15,
      "in_flight": 0,
      "manager_connections": 1,
      "manager_connections_peak": 1,
      "queued": 0,
      "rss_bytes": 19644416,